==337719== Memcheck, a memory error detector
==337719== Copyright (C) 2002-2017, and GNU GPL'd, by Julian Seward et al.
==337719== Using Valgrind-3.18.1 and LibVEX; rerun with -h for copyright info
==337719== Command: /home/marsenij/Documents/minishell/minishell
==337719== Parent PID: 337718
==337719== 
==337719== Invalid read of size 8
==337719==    at 0x45CBBF: fuse_all_0space_nodes (fuse_nodes.c:48)
==337719==    by 0x454B92: parse (parse.c:111)
==337719==    by 0x4261F7: main (main.c:111)
==337719==  Address 0x4c35ae8 is 24 bytes inside a block of size 32 free'd
==337719==    at 0x484B27F: free (in /usr/libexec/valgrind/vgpreload_memcheck-amd64-linux.so)
==337719==    by 0x45C6DB: fuse_node_with_next (fuse_nodes.c:32)
==337719==    by 0x45CB36: fuse_all_0space_nodes (fuse_nodes.c:47)
==337719==    by 0x454B92: parse (parse.c:111)
==337719==    by 0x4261F7: main (main.c:111)
==337719==  Block was alloc'd at
==337719==    at 0x4848899: malloc (in /usr/libexec/valgrind/vgpreload_memcheck-amd64-linux.so)
==337719==    by 0x450B0D: ft_lstnew (lsthelper.c:21)
==337719==    by 0x4504CE: make_tokens (token.c:85)
==337719==    by 0x450A87: tokenize (token.c:111)
==337719==    by 0x4261DB: main (main.c:108)
==337719== 
==337719== Invalid read of size 8
==337719==    at 0x458BD6: expand_var (expand.c:66)
==337719==    by 0x454AF2: parse (parse.c:99)
==337719==    by 0x4261F7: main (main.c:111)
==337719==  Address 0x4c3c470 is 16 bytes inside a block of size 32 free'd
==337719==    at 0x484B27F: free (in /usr/libexec/valgrind/vgpreload_memcheck-amd64-linux.so)
==337719==    by 0x451A15: ft_lstdelone (lsthelper.c:97)
==337719==    by 0x4545E6: split_to_token (parse.c:67)
==337719==    by 0x459427: handle_expandable_var (expand.c:35)
==337719==    by 0x458B35: expand_var (expand.c:62)
==337719==    by 0x454AF2: parse (parse.c:99)
==337719==    by 0x4261F7: main (main.c:111)
==337719==  Block was alloc'd at
==337719==    at 0x4848899: malloc (in /usr/libexec/valgrind/vgpreload_memcheck-amd64-linux.so)
==337719==    by 0x450B0D: ft_lstnew (lsthelper.c:21)
==337719==    by 0x4504CE: make_tokens (token.c:85)
==337719==    by 0x450A87: tokenize (token.c:111)
==337719==    by 0x4261DB: main (main.c:108)
==337719== 
==337719== 
==337719== FILE DESCRIPTORS: 4 open (3 std) at exit.
==337719== Open file descriptor 3: /tmp/tmp.2XiJDvuNm3/tmp_valgrind_out
==337719==    <inherited from parent>
==337719== 
==337719== Open file descriptor 2: /dev/null
==337719==    <inherited from parent>
==337719== 
==337719== Open file descriptor 1: /dev/null
==337719==    <inherited from parent>
==337719== 
==337719== Open file descriptor 0:
==337719==    <inherited from parent>
==337719== 
==337719== 
==337719== HEAP SUMMARY:
==337719==     in use at exit: 12,590 bytes in 128 blocks
==337719==   total heap usage: 300 allocs, 172 frees, 26,301 bytes allocated
==337719== 
==337719== 6 bytes in 1 blocks are still reachable in loss record 1 of 14
==337719==    at 0x4848899: malloc (in /usr/libexec/valgrind/vgpreload_memcheck-amd64-linux.so)
==337719==    by 0x460EA1: ft_strdup (ft_strdup.c:42)
==337719==    by 0x449F5D: creating_new_exo (export2.c:108)
==337719==    by 0x44A61E: new_exo_env (export2.c:136)
==337719==    by 0x43DF42: export (builtins.c:108)
==337719==    by 0x433339: builtin_cmds (executor.c:24)
==337719==    by 0x42A7BC: no_pipe_exe (pipes_processes2.c:89)
==337719==    by 0x43403F: executor (executor.c:100)
==337719==    by 0x4262CC: main (main.c:113)
==337719== 
==337719== 6 bytes in 1 blocks are still reachable in loss record 2 of 14
==337719==    at 0x4848899: malloc (in /usr/libexec/valgrind/vgpreload_memcheck-amd64-linux.so)
==337719==    by 0x460EA1: ft_strdup (ft_strdup.c:42)
==337719==    by 0x449F5D: creating_new_exo (export2.c:108)
==337719==    by 0x44A61E: new_exo_env (export2.c:136)
==337719==    by 0x43E0CF: export (builtins.c:114)
==337719==    by 0x433339: builtin_cmds (executor.c:24)
==337719==    by 0x42A7BC: no_pipe_exe (pipes_processes2.c:89)
==337719==    by 0x43403F: executor (executor.c:100)
==337719==    by 0x4262CC: main (main.c:113)
==337719== 
==337719== 13 bytes in 2 blocks are indirectly lost in loss record 3 of 14
==337719==    at 0x4848899: malloc (in /usr/libexec/valgrind/vgpreload_memcheck-amd64-linux.so)
==337719==    by 0x460EA1: ft_strdup (ft_strdup.c:42)
==337719==    by 0x455A87: get_args (prep_exec2.c:53)
==337719==    by 0x4552A4: process_tokens (prep_exec.c:60)
==337719==    by 0x455315: prep_nodes_for_exec (prep_exec.c:74)
==337719==    by 0x454BE1: parse (parse.c:120)
==337719==    by 0x4261F7: main (main.c:111)
==337719== 
==337719== 15 bytes in 1 blocks are still reachable in loss record 4 of 14
==337719==    at 0x4848899: malloc (in /usr/libexec/valgrind/vgpreload_memcheck-amd64-linux.so)
==337719==    by 0x460EA1: ft_strdup (ft_strdup.c:42)
==337719==    by 0x435AF5: core_direct_user (environment.c:47)
==337719==    by 0x435F91: environment_copy (environment.c:74)
==337719==    by 0x436436: copy_env (environment.c:101)
==337719==    by 0x425E61: main (main.c:84)
==337719== 
==337719== 24 bytes in 1 blocks are indirectly lost in loss record 6 of 14
==337719==    at 0x4848899: malloc (in /usr/libexec/valgrind/vgpreload_memcheck-amd64-linux.so)
==337719==    by 0x455849: get_args (prep_exec2.c:46)
==337719==    by 0x4552A4: process_tokens (prep_exec.c:60)
==337719==    by 0x455315: prep_nodes_for_exec (prep_exec.c:74)
==337719==    by 0x454BE1: parse (parse.c:120)
==337719==    by 0x4261F7: main (main.c:111)
==337719== 
==337719== 85 (48 direct, 37 indirect) bytes in 1 blocks are definitely lost in loss record 9 of 14
==337719==    at 0x4848899: malloc (in /usr/libexec/valgrind/vgpreload_memcheck-amd64-linux.so)
==337719==    by 0x45A9FB: ft_lstnew_cmd (cmd_lst.c:19)
==337719==    by 0x454C0E: initialize_cmd_table (prep_exec.c:21)
==337719==    by 0x455304: prep_nodes_for_exec (prep_exec.c:73)
==337719==    by 0x454BE1: parse (parse.c:120)
==337719==    by 0x4261F7: main (main.c:111)
==337719== 
==337719== 472 bytes in 1 blocks are still reachable in loss record 10 of 14
==337719==    at 0x4848899: malloc (in /usr/libexec/valgrind/vgpreload_memcheck-amd64-linux.so)
==337719==    by 0x44A2BA: new_exo_env (export2.c:125)
==337719==    by 0x43DF42: export (builtins.c:108)
==337719==    by 0x433339: builtin_cmds (executor.c:24)
==337719==    by 0x42A7BC: no_pipe_exe (pipes_processes2.c:89)
==337719==    by 0x43403F: executor (executor.c:100)
==337719==    by 0x4262CC: main (main.c:113)
==337719== 
==337719== 472 bytes in 1 blocks are still reachable in loss record 11 of 14
==337719==    at 0x4848899: malloc (in /usr/libexec/valgrind/vgpreload_memcheck-amd64-linux.so)
==337719==    by 0x44A2BA: new_exo_env (export2.c:125)
==337719==    by 0x43E0CF: export (builtins.c:114)
==337719==    by 0x433339: builtin_cmds (executor.c:24)
==337719==    by 0x42A7BC: no_pipe_exe (pipes_processes2.c:89)
==337719==    by 0x43403F: executor (executor.c:100)
==337719==    by 0x4262CC: main (main.c:113)
==337719== 
==337719== 3,706 bytes in 56 blocks are still reachable in loss record 12 of 14
==337719==    at 0x4848899: malloc (in /usr/libexec/valgrind/vgpreload_memcheck-amd64-linux.so)
==337719==    by 0x460EA1: ft_strdup (ft_strdup.c:42)
==337719==    by 0x44A435: new_exo_env (export2.c:131)
==337719==    by 0x43DF42: export (builtins.c:108)
==337719==    by 0x433339: builtin_cmds (executor.c:24)
==337719==    by 0x42A7BC: no_pipe_exe (pipes_processes2.c:89)
==337719==    by 0x43403F: executor (executor.c:100)
==337719==    by 0x4262CC: main (main.c:113)
==337719== 
==337719== 3,706 bytes in 56 blocks are still reachable in loss record 13 of 14
==337719==    at 0x4848899: malloc (in /usr/libexec/valgrind/vgpreload_memcheck-amd64-linux.so)
==337719==    by 0x460EA1: ft_strdup (ft_strdup.c:42)
==337719==    by 0x44A435: new_exo_env (export2.c:131)
==337719==    by 0x43E0CF: export (builtins.c:114)
==337719==    by 0x433339: builtin_cmds (executor.c:24)
==337719==    by 0x42A7BC: no_pipe_exe (pipes_processes2.c:89)
==337719==    by 0x43403F: executor (executor.c:100)
==337719==    by 0x4262CC: main (main.c:113)
==337719== 
==337719== LEAK SUMMARY:
==337719==    definitely lost: 48 bytes in 1 blocks
==337719==    indirectly lost: 37 bytes in 3 blocks
==337719==      possibly lost: 0 bytes in 0 blocks
==337719==    still reachable: 8,383 bytes in 117 blocks
==337719==         suppressed: 4,122 bytes in 7 blocks
==337719== 
==337719== ERROR SUMMARY: 12 errors from 12 contexts (suppressed: 4 from 4)
==337719== 
==337719== 1 errors in context 1 of 12:
==337719== Invalid read of size 8
==337719==    at 0x458BD6: expand_var (expand.c:66)
==337719==    by 0x454AF2: parse (parse.c:99)
==337719==    by 0x4261F7: main (main.c:111)
==337719==  Address 0x4c3c470 is 16 bytes inside a block of size 32 free'd
==337719==    at 0x484B27F: free (in /usr/libexec/valgrind/vgpreload_memcheck-amd64-linux.so)
==337719==    by 0x451A15: ft_lstdelone (lsthelper.c:97)
==337719==    by 0x4545E6: split_to_token (parse.c:67)
==337719==    by 0x459427: handle_expandable_var (expand.c:35)
==337719==    by 0x458B35: expand_var (expand.c:62)
==337719==    by 0x454AF2: parse (parse.c:99)
==337719==    by 0x4261F7: main (main.c:111)
==337719==  Block was alloc'd at
==337719==    at 0x4848899: malloc (in /usr/libexec/valgrind/vgpreload_memcheck-amd64-linux.so)
==337719==    by 0x450B0D: ft_lstnew (lsthelper.c:21)
==337719==    by 0x4504CE: make_tokens (token.c:85)
==337719==    by 0x450A87: tokenize (token.c:111)
==337719==    by 0x4261DB: main (main.c:108)
==337719== 
==337719== 
==337719== 1 errors in context 2 of 12:
==337719== Invalid read of size 8
==337719==    at 0x45CBBF: fuse_all_0space_nodes (fuse_nodes.c:48)
==337719==    by 0x454B92: parse (parse.c:111)
==337719==    by 0x4261F7: main (main.c:111)
==337719==  Address 0x4c35ae8 is 24 bytes inside a block of size 32 free'd
==337719==    at 0x484B27F: free (in /usr/libexec/valgrind/vgpreload_memcheck-amd64-linux.so)
==337719==    by 0x45C6DB: fuse_node_with_next (fuse_nodes.c:32)
==337719==    by 0x45CB36: fuse_all_0space_nodes (fuse_nodes.c:47)
==337719==    by 0x454B92: parse (parse.c:111)
==337719==    by 0x4261F7: main (main.c:111)
==337719==  Block was alloc'd at
==337719==    at 0x4848899: malloc (in /usr/libexec/valgrind/vgpreload_memcheck-amd64-linux.so)
==337719==    by 0x450B0D: ft_lstnew (lsthelper.c:21)
==337719==    by 0x4504CE: make_tokens (token.c:85)
==337719==    by 0x450A87: tokenize (token.c:111)
==337719==    by 0x4261DB: main (main.c:108)
==337719== 
--337719-- 
--337719-- used_suppression:      4 libreadline /home/marsenij/42_minishell_tester/utils/minishell.supp:2 suppressed: 4,122 bytes in 7 blocks
==337719== 
==337719== ERROR SUMMARY: 12 errors from 12 contexts (suppressed: 4 from 4)
